{
  "evaluation_id": "BENCH-CORE-08-HC-0107-MASKED-V0.1",
  "constitution": {
    "version": "0.1.0",
    "ref": "constitution/MORAL_CORE.md@b02a44b02a4d14a50a2f0fc3e92bfde5b499cfbd",
    "content_digest": "git-blob-sha1:1a83691fea5604ab85a8945e0d1ed8ccd009c7cf",
    "interpretation_rules_ref": "constitution/INTERPRETATION_RULES.md@b02a44b02a4d14a50a2f0fc3e92bfde5b499cfbd"
  },
  "proposal": {
    "actor": "states negotiating the Montreal Protocol",
    "action": "Adopt binding staged production/consumption controls with differentiated implementation and periodic review.",
    "purpose": "reduce a serious plausible long-lived global atmospheric risk while allowing transition and evidence-based adjustment",
    "requested_authority": "Adopt binding staged production/consumption controls with differentiated implementation and periodic review.",
    "urgency": "unknown",
    "reversibility": "unknown"
  },
  "evidence": [
    {
      "evidence_id": "E1",
      "claim": "Scientific work identifies a credible chemical mechanism by which the long-lived industrial substances reach the upper atmosphere and catalytically damage the protective layer.",
      "epistemic_status": "reported",
      "confidence": "unknown"
    },
    {
      "evidence_id": "E2",
      "claim": "Recent ground observations show an unexpectedly severe recurring regional depletion of the protective layer.",
      "epistemic_status": "reported",
      "confidence": "unknown"
    },
    {
      "evidence_id": "E3",
      "claim": "Additional observations/analysis support that the phenomenon is real and linked to the relevant chemistry, while details/global extrapolation remain under refinement.",
      "epistemic_status": "reported",
      "confidence": "unknown"
    },
    {
      "evidence_id": "E4",
      "claim": "Damage to the protective layer increases biologically harmful radiation at the surface, creating plausible serious health/ecological risks even though exact future incidence is uncertain.",
      "epistemic_status": "reported",
      "confidence": "unknown"
    },
    {
      "evidence_id": "E5",
      "claim": "The substances are long-lived and globally mixed, so benefits of use can be local/immediate while risks are exported geographically and temporally.",
      "epistemic_status": "reported",
      "confidence": "unknown"
    },
    {
      "evidence_id": "E6",
      "claim": "Controls impose genuine industrial/consumer costs because the substances have valuable uses and substitute technologies are unevenly mature.",
      "epistemic_status": "observed",
      "confidence": "unknown"
    },
    {
      "evidence_id": "E7",
      "claim": "An existing international framework already supports research/monitoring but does not impose the binding reductions now under consideration.",
      "epistemic_status": "observed",
      "confidence": "unknown"
    },
    {
      "evidence_id": "E8",
      "claim": "A staged agreement can target major substances first, differentiate lower-capacity implementation and mandate periodic science/economic assessment so controls can change with evidence.",
      "epistemic_status": "observed",
      "confidence": "unknown"
    },
    {
      "evidence_id": "E9",
      "claim": "Waiting for precise proof allows additional long-lived pollutant accumulation, making later reversal slower if stronger evidence emerges.",
      "epistemic_status": "inferred",
      "confidence": "unknown"
    }
  ],
  "affected_parties": [
    {
      "party": "current/future populations exposed if the atmospheric protection system degrades",
      "interests_or_risks": "Health consequences of increased harmful radiation and related environmental effects.",
      "power_position": "mixed",
      "voice_in_decision": "unknown"
    },
    {
      "party": "future generations",
      "interests_or_risks": "Inherited long-lived atmospheric damage created before they can influence decisions.",
      "power_position": "very_low",
      "voice_in_decision": "unknown"
    },
    {
      "party": "ecosystems/agriculture",
      "interests_or_risks": "Potential biological/productivity/biodiversity effects.",
      "power_position": "very_low",
      "voice_in_decision": "unknown"
    },
    {
      "party": "chemical producers/dependent industries",
      "interests_or_risks": "Investment, jobs, product performance and transition/retooling costs.",
      "power_position": "high",
      "voice_in_decision": "unknown"
    },
    {
      "party": "consumers/public services",
      "interests_or_risks": "Price, availability, safety and reliable substitutes.",
      "power_position": "mixed",
      "voice_in_decision": "unknown"
    },
    {
      "party": "lower-capacity/developing states",
      "interests_or_risks": "Development, technology access and avoiding disproportionate transition burdens for a globally generated problem.",
      "power_position": "low",
      "voice_in_decision": "unknown"
    }
  ],
  "alternatives": [
    {
      "alternative_id": "A1",
      "description": "Use voluntary industry/national targets while research continues.",
      "feasibility": "unknown"
    },
    {
      "alternative_id": "A2",
      "description": "Delay binding controls until future harm and industrial alternatives are much more certain.",
      "feasibility": "unknown"
    },
    {
      "alternative_id": "A3",
      "description": "Impose an immediate near-total ban regardless of substitution feasibility/capacity.",
      "feasibility": "unknown"
    },
    {
      "alternative_id": "A4",
      "description": "Combine staged controls with financial/technical cooperation for lower-capacity countries.",
      "feasibility": "unknown"
    },
    {
      "alternative_id": "A5",
      "description": "Voluntary reductions plus expanded research/monitoring.",
      "feasibility": "unknown"
    },
    {
      "alternative_id": "A6",
      "description": "Binding initial controls on the highest-risk chemicals with periodic reassessment.",
      "feasibility": "unknown"
    },
    {
      "alternative_id": "A7",
      "description": "Immediate comprehensive ban.",
      "feasibility": "unknown"
    },
    {
      "alternative_id": "A8",
      "description": "Staged controls plus finance/technology support for lower-capacity states.",
      "feasibility": "unknown"
    },
    {
      "alternative_id": "A9",
      "description": "No binding controls until substantially greater certainty.",
      "feasibility": "unknown"
    }
  ],
  "uncertainties": [
    "Exact future global/regional depletion under alternative emissions paths.",
    "Exact downstream health/ecological burden and timing.",
    "Cost/safety/technical maturity of substitutes in every application.",
    "Transition speed without major supply/price disruption.",
    "Fair burden allocation across differently responsible/capable states.",
    "Whether initial staged reductions will be sufficient or later need strengthening."
  ],
  "declared_conflicts_of_interest": [],
  "requested_capability": "Adopt binding staged production/consumption controls with differentiated implementation and periodic review."
}
